{
  "$schema": "https://json-schema.org/draft/2020-12/schema",
  "$id": "https://github.com/tprouvot/agentforce-conversation-recorder/schema/pack.schema.json",
  "title": "Selector pack",
  "description": "Every locator the recorder needs for one chat surface, as data. Each element lists candidates tried in order; the first that matches wins. A pack never contains code.",
  "type": "object",
  "additionalProperties": false,
  "required": ["id", "surface", "version", "minApiVersion", "elements"],
  "properties": {
    "$schema": { "type": "string" },
    "id": { "type": "string", "pattern": "^[a-z0-9-]+(@v\\d+)?$", "description": "lightning, messaging, or <surface>@v<api> for a pack that applies from that API version." },
    "surface": { "type": "string", "enum": ["lightning", "messaging"] },
    "version": { "type": "string", "pattern": "^\\d{4}\\.\\d{1,2}\\.\\d+$", "description": "YYYY.MM.N: newer wins among packs for the same releases." },
    "minApiVersion": { "type": "number", "minimum": 40, "description": "The pack applies to orgs at this API version or later (until a pack with a higher minimum takes over)." },
    "verified": {
      "type": "array",
      "description": "Where the pack was checked live (by afrec doctor) or against fixtures.",
      "items": {
        "type": "object",
        "additionalProperties": false,
        "properties": {
          "apiVersion": { "type": "number" },
          "release": { "type": "string" },
          "date": { "type": "string" },
          "by": { "type": "string" }
        }
      }
    },
    "elements": {
      "type": "object",
      "additionalProperties": {
        "type": "object",
        "additionalProperties": false,
        "required": ["candidates"],
        "properties": {
          "description": { "type": "string" },
          "match": { "type": "string", "enum": ["first", "any"], "description": "first (default): the first candidate that matches anything is used. any: an element matching any candidate counts (busy indicators, system events)." },
          "candidates": { "type": "array", "minItems": 1, "items": { "$ref": "#/$defs/candidate" } }
        }
      }
    }
  },
  "$defs": {
    "candidate": {
      "type": "object",
      "additionalProperties": false,
      "properties": {
        "role": { "type": "string", "description": "ARIA role (explicit or implicit for Playwright, explicit in page)." },
        "name": { "type": "string", "description": "Case-insensitive regex on the accessible name (aria-label, title, text)." },
        "css": { "type": "string", "description": "CSS selector (Playwright pierces open shadow roots)." },
        "tag": { "type": "string", "description": "Exact tag name, lower case." },
        "tagPattern": { "type": "string", "description": "Regex on the tag name (in page only)." },
        "class": { "type": "string", "description": "One class the element carries." },
        "classPattern": { "type": "string", "description": "Regex on the class attribute (in page only)." },
        "text": { "type": "string", "description": "Case-insensitive regex on the element's text." },
        "title": { "type": "string", "description": "Case-insensitive regex on the title attribute." },
        "label": { "type": "string", "description": "Case-insensitive regex on aria-label." },
        "attr": { "type": "object", "description": "Attribute name to regex (or true: present)." },
        "not": { "type": "object", "description": "A candidate the element must NOT match." },
        "source": { "type": "string", "description": "Where the candidate came from: pack, healed, utam." },
        "note": { "type": "string", "description": "Why the candidate exists." }
      }
    }
  }
}
